Service Desk engineer | Casablanca (Maroc), bachelor degree in computer engineering/computer science/information technology. Air Arabia (PJSC), listed on the Dubai Financial Market, is the Middle East and North Africa’s first and leading low-cost carrier flying to over 150... To provide IT support services to Air Arabia Group users and business teams through various channels such as telephone, web, email or in-person as required.... 29/11/2021 29/01/2022 1, Publication : du 29/11/2021 au 29/01/2022 | Postes proposés: 1, Air Arabia (PJSC), listed on the Dubai Financial Market, is the Middle East and North Africa’s first and leading low-cost carrier flying to over 150...
Project Management Officer | Ben Guerir (Maroc), • engineer or master’s degree in management or related field engineer Université Mohammed VI Polytechnique: About UM6P:Mohammed VI Polytechnic University (UM6P,https://www.um6p.ma/en) is an international higher education institution, established to provide research...  Job/Project description:As part of the human resource development of the Center of Soil and Fertilizer Research in Africa, it is urgently required to recruit a... 26/11/2021 26/01/2022 1, Publication : du 26/11/2021 au 26/01/2022 | Postes proposés: 1, engineer
Senior fullstack developer | Benguerir (Maroc), engineer degree engineer Université Mohammed VI Polytechnique:Mohammed VI Polytechnic University is an institution dedicated to research and innovation in Africa and aims to position itself among world-renowned... We are looking for a Senior fullstack developer to join our engineering team. Our engineering team works with the latest technology - constantly improving our... 25/11/2021 25/01/2022 1, Publication : du 25/11/2021 au 25/01/2022 | Postes proposés: 1, engineer
Software engineer | Benguerir (Maroc), engineer degree engineer Université Mohammed VI Polytechnique:Mohammed VI Polytechnic University is an institution dedicated to research and innovation in Africa and aims to position itself among world-renowned... We are looking for a Software engineer to join our engineering team. Basic Qualifications: Engineer Degree 3+ years experience programming experience in MERN.... 25/11/2021 25/01/2022 1, Publication : du 25/11/2021 au 25/01/2022 | Postes proposés: 1, engineer
AI & Data Science Lead | Casablanca (Maroc), • bac + 5 ou ingénieur avec une spécialité tel que (modélisation et science des données, sciences des données et big data, télédétection et géométrie, data & software engineer, data engineer science des données…etc), vous justifiez d’une expérience de 2 à 5 ans dans un environnement agro-industriel ou autre en tant que data scientist ou data analyst. • maîtrise des techniques et des méthodes liées aux mathématiques appliquées et aux statistiques, • maîtrise des langages de programmation python et r, • maîtrise des langages et des outils de gestion des bases de données sql et non-sql, • maîtrise des outils de gestion des données (sas, spss…). • maîtrise des outils et des algorithmes de traitement d’images, • connaissance des techniques de gestion de projet, • une bonne maitrise langue française à l’écrit et à l’oral. • maitrise de l’anglais. engineer engineer Confidentiel: Entreprise industrielle recherche, un AI & Data Science Lead pour renforcer son centre de compétence pour la région de Casablanca. - Conception et prototypage des Use Cases métiers liés à la donnée en concertation avec les Product-Owners, - Elaboration et... 25/11/2021 25/01/2022, Publication : du 25/11/2021 au 25/01/2022, engineer
Salesforce Consultant | Casablanca (Maroc), bachelor's degree in software development, computer engineering, you have a growing trailhead profile or you have a first experience in object-oriented programming and web design / technologies (html, css, javascript); Leyton: Thanks to our unique methods and 23 years of knowledge and experience, our clients can benefit from complementary sources of financing while remaining focused... Within the international CRM Salesforce Team : You will take part in all the developments of our salesforce application: design, creation, test,... 23/11/2021 23/01/2022 1, Publication : du 23/11/2021 au 23/01/2022 | Postes proposés: 1, Leyton: Thanks to our unique methods and 23 years of knowledge and experience, our clients can benefit from complementary sources of financing while remaining focused...
Civil Manager, Terminal Infrastructure Development - Tanger Med II - Project Contract | Tanger (Maroc), • minimum 7 years relevant experience in a civil engineering and/or construction project related environment . • project or package management experience, where exposure to project controls has a preference. • good working knowledge of civil works contract, particularly involving design & build; knowledge of fidic contracts has a preference • experience of managing large scale infrastructure construction projects or packages with multiple reports and with clear responsibility on achieving safety, time and budget targets. • have a strong understanding of design and construction, built on a solid foundation of technical engineering skills. • team player, capable of motivating peers and reports in order to achieve project success. • good communication skills, where sufficient level of english and french is a must. • driven, self-motivating, result orientated. • high discipline – following through on actions and ensuring necessary documentation. • high quality awareness and ability to work with constant care. • sensitive to cultural diversity and experience in a multicultural environment, in regard to colleagues, employees of designers and contractors, and other stakeholders. APM Terminals operates one of the world’s most comprehensive port and integrated inland service networks and continues investing in new business... We Offer APM Terminals offers tremendous growth, career and leadership opportunities for those with the ambition, drive and dedication to become one of the... 19/11/2021 19/01/2022 1, Publication : du 19/11/2021 au 19/01/2022 | Postes proposés: 1, APM Terminals operates one of the world’s most comprehensive port and integrated inland service networks and continues investing in new business...
engineer position in Numerical Systems and Calculations | Benguerir (Maroc), engineer (or equivalent) in high performance computing and numerical methods, weather and/or climate science, physics or related discipline. engineer Université Mohammed VI Polytechnique:Mohammed VI Polytechnic University is an institution dedicated to research and innovation in Africa and aims to position itself among world-renowned... Mohammed VI Polytechnic University International Water Research Institute (IWRI)  Position Announcement  Job Title: Engineer position in Numerical Systems and... 18/11/2021 18/01/2022 1, Publication : du 18/11/2021 au 18/01/2022 | Postes proposés: 1, engineer
Research engineer position in Climate modeling | Benguerir (Maroc), engineer (or equivalent) in weather and/or climate science, high performance computing science, physics or related discipline. engineer Université Mohammed VI Polytechnique:Mohammed VI Polytechnic University is an institution dedicated to research and innovation in Africa and aims to position itself among world-renowned... Mohammed VI Polytechnic University International Water Research Institute (IWRI)  Position Announcement  Job Title: Research Engineer position in Climate... 18/11/2021 18/01/2022 1, Publication : du 18/11/2021 au 18/01/2022 | Postes proposés: 1, engineer
R&D Consultant ICT (Information & communication technology) | Casablanca (Maroc),   your assets? - a graduate from a top ranked engineering schools in (ict) field - having an international outlook in terms of studies or professional experiences, particularly in france ; - having at least 3 years relevant work experience, ideally in consulting field ; - excellent writing and communication skills in french with an analytical mind - curiosity, dynamism, adaptability, good interpersonal skills and team spirit are your key success factors ; Leyton: Thanks to our unique methods and 23 years of knowledge and experience, our clients can benefit from complementary sources of financing while remaining focused... Thanks to our unique methods and 23 years of knowledge and experience, our clients can benefit from complementary sources of financing while remaining focused... 18/11/2021 18/01/2022 4, Publication : du 18/11/2021 au 18/01/2022 | Postes proposés: 4, Leyton: Thanks to our unique methods and 23 years of knowledge and experience, our clients can benefit from complementary sources of financing while remaining focused...
CBM/PDM engineer: | Tanger (Maroc), - we are looking for you hold an engineering degree (bachelor or master) or equivalent preferably in mechanical, electrical, electronics or automation and you have maintenance experience (5+ years) of which at least 3 years in relevant roles within the heavy asset industry. - you have design experience in establishing state of the art pdm systems with smart sensors, data communication (iot) , data analysis (algorithms), and artificial intelligence ai. - having practical experience in performing weibull analysis (reliability life-data analysis), calculate risk of failures, and producing p-f curve simulating the equipment failure characteristics. - having sound knowledge and experience in how to establish a cbm/pdm system for hidden failure modes of assets. - having experience in asset criticality analysis, and root cause analysis rca. - have a hands-on attitude to solve problems and strong analytical skills with proven expertise in data analytics, statistical tools, advanced excel, and cmms. - having experience in heavy asset monitoring and maintenance as well as with data-driven classification: internal maintenance routines for digitalized terminal equipment, equipment condition monitoring and predictive maintenance practices, will help you to succeed in this role. - you have a high-quality awareness and the ability to work with constant care - your english communication skills are excellent both in speaking as well as in writing. - if you are looking for a positive change in career and if you are ready for this challenge, you are welcome to our apm terminals- am: reliability team.   APM Terminals is a port infrastructure leader, uniquely positioned to help both shipping line and landside customers grow their business and achieve... At APMT we value the diversity of our talent and will always strive to recruit the best person for the job we value diversity in all its forms, including but... 18/11/2021 18/01/2022 1, Publication : du 18/11/2021 au 18/01/2022 | Postes proposés: 1, APM Terminals is a port infrastructure leader, uniquely positioned to help both shipping line and landside customers grow their business and achieve...
Reliability engineer | Tanger (Maroc), - bachelor's or advanced degree in an engineering or a scientific discipline - approximately 5 or more years experience in a heavy industries maintenance environment. - demonstrated knowledge and experience with plant maintenance and reliability. - ability to support a 24/7 operation, and maintenance in apm terminals globally. - advanced knowledge of mechanical and electrical systems, preventive and predictive maintenance systems, and condition monitoring and fixed time maintenance strategies. - sound knowledge and experience of ram tools (fbd analysis, fmeca, fmea, rca, and rsa) is a must. - knowledge and experience with rams software tools is considered. - deep knowledge and experience of weibull analysis is a must. - advanced knowledge of precision alignment and vibration analysis. - advanced cmms planning and scheduling knowledge preferred. - advanced knowledge of parts inventory management, and mechanical and electrical equipment design reliability principles. - basic knowledge of six sigma methodology (dmaic) preferred. - your english communication skills are excellent both in speaking as well as in writing. - if you are looking for a positive change in career and if you are ready for this challenge, you are welcome to our apm terminals- am: reliability team.   APM Terminals is a port infrastructure leader, uniquely positioned to help both shipping line and landside customers grow their business and achieve... At APMT we value the diversity of our talent and will always strive to recruit the best person for the job we value diversity in all its forms, including but... 18/11/2021 18/01/2022 1, Publication : du 18/11/2021 au 18/01/2022 | Postes proposés: 1, APM Terminals is a port infrastructure leader, uniquely positioned to help both shipping line and landside customers grow their business and achieve...
CBM/PdM Supervisor: | Tanger (Maroc), qualifications - we are looking for you hold an engineering degree (bachelor or master) or equivalent preferably in mechanical, electrical, electronics or automation and you have maintenance experience (9+ years) of which at least 5 years in relevant roles within the heavy asset industry. - you have design experience in establishing state of the art pdm systems with smart sensors, data communication (iot), data analysis (algorithms), and artificial intelligence ai and asset digitalization ai. - having practical experience in performing weibull analysis (reliability life-data analysis), calculate risk of failures, and producing p-f curve simulating the equipment failure characteristics. - having sound experience in vibration meters, sound analyzers and other cbm techniques and pdm applications such as vibration analysis, thermography, ultrasound inspection technology and ndt. - must have knowledge of oil testing methods (part counts, ferrography, spectrum oil analysis program soap, inductively coupled plasma icp, …etc). knowledge of lubricating oil sensors, cbm/pdm, and iot technology. - you are result oriented and your english communication skills are excellent both in speaking as well as in writing. - if you are looking for a positive change in career and if you are ready for this challenges, you are welcome to our reliability team. APM Terminals is a port infrastructure leader, uniquely positioned to help both shipping line and landside customers grow their business and achieve... At APMT we value the diversity of our talent and will always strive to recruit the best person for the job we value diversity in all its forms, including but... 18/11/2021 18/01/2022 1, Publication : du 18/11/2021 au 18/01/2022 | Postes proposés: 1, APM Terminals is a port infrastructure leader, uniquely positioned to help both shipping line and landside customers grow their business and achieve...
Spanish Speaker - Data Analyst | Tanger (Maroc), engineering graduate with 2-4 years of experience in ‘part/material mdm’ function.   APM Terminals is a port infrastructure leader, uniquely positioned to help both shipping line and landside customers grow their business and... Purpose/Summary • Ensure data quality, compliance and consistency of master data across business systems • Execute changes to IFS product master... 18/11/2021 18/01/2022 2, Publication : du 18/11/2021 au 18/01/2022 | Postes proposés: 2,   APM Terminals is a port infrastructure leader, uniquely positioned to help both shipping line and landside customers grow their business and...
PhD Position - AI and Game Theory-based Security modeling for Cloud/IOT Systems | RABAT (Maroc), master or engineer in computer science or similar discipline engineer Université Mohammed VI Polytechnique:The Cyber Security and Critical Infrastructure Protection (CyS&CIP) Research Center is the first of its kind in Morocco, and among the two first in Africa.... The Cyber Security and Critical Infrastructure Protection (CyS&CIP) Research Center is the first of its kind in Morocco, and among the two first in Africa.... 16/11/2021 16/01/2022 1, Publication : du 16/11/2021 au 16/01/2022 | Postes proposés: 1, engineer
PhD Position - Trusted computing for identity management and secure data sharing 1 | BENGUERIR (Maroc), master or engineer in computer science or similar discipline engineer Université Mohammed VI Polytechnique:The Cyber Security and Critical Infrastructure Protection (CyS&CIP) Research Center is the first of its kind in Morocco, and among the two first in Africa....   Attacks on computer systems and networks are on rise. Corporation, governments, and industrials are witnessing an augmentation of ransomwares, a threat to... 16/11/2021 16/01/2022 1, Publication : du 16/11/2021 au 16/01/2022 | Postes proposés: 1, engineer
PhD position in hydroinformatics | BENGUERIR (Maroc), the potential applicant must have a higher university degree (engineering, msc or equivalent) in a relevant field (modeling engineering, hydraulic engineering, or process engineering), and the ability to complete the doctoral studies within the targeted timeframe of four years. candidates with backgrounds in one of the aforementioned engineering fields with a previous related industrial experience are particularly encouraged to apply. Université Mohammed VI Polytechnique:Mohammed VI Polytechnic UniversityInternational Water Research Institute (IWRI) Position Announcement: PhD position in hydroinformatics Area of...   Job description:The PhD student will work on the research project “Mathematical modeling and optimization of OCP’s seawater intake pumping stations”. The aim... 16/11/2021 16/01/2022 1, Publication : du 16/11/2021 au 16/01/2022 | Postes proposés: 1, Université Mohammed VI Polytechnique:Mohammed VI Polytechnic UniversityInternational Water Research Institute (IWRI) Position Announcement: PhD position in hydroinformatics Area of...
PhD position in Metallurgy (industrial casting) at HTMR laboratory | BENGUERIR (Maroc), applicants must have a degree in engineering or master's (or equivalent) in mechanical engineering, chemical engineering, mineral engineering, physical-chemistry or another relevant field. Université Mohammed VI Polytechnique:Description de l’UM6PLocated at the heart of the future Green City in Benguerir, Mohammed VI Polytechnic University (UM6P), a higher education institution with... Description d¢emploiCasting is a manufacturing method by which, molten metal is poured into a mould cavity that has a certain shape; upon solidification, the... 16/11/2021 16/01/2022 1, Publication : du 16/11/2021 au 16/01/2022 | Postes proposés: 1, Université Mohammed VI Polytechnique:Description de l’UM6PLocated at the heart of the future Green City in Benguerir, Mohammed VI Polytechnic University (UM6P), a higher education institution with...
PhD position in Metallurgy (alloy design) at HTMR laboratory | BENGUERIR (Maroc), applicants must have a degree in engineering or master's (or equivalent) in chemistry and/or physics of inorganic materials, chemical engineering, mineral engineering, physical-chemistry or another relevant field. Université Mohammed VI Polytechnique:Description de l’UM6PLocated at the heart of the future Green City in Benguerir, Mohammed VI Polytechnic University (UM6P), a higher education institution with... Description d¢emploiCorrosion and wear (erosion/abrasion) are two of the most relevant phenomena responsible for the degradation of metallic materials used in... 16/11/2021 16/01/2022 1, Publication : du 16/11/2021 au 16/01/2022 | Postes proposés: 1, Université Mohammed VI Polytechnique:Description de l’UM6PLocated at the heart of the future Green City in Benguerir, Mohammed VI Polytechnic University (UM6P), a higher education institution with...
CEDOC Computer Science : Query Optimization for Similarity Search | BENGUERIR (Maroc), an engineering or master’s degree in computer science from an institution recognized by the university. Université Mohammed VI Polytechnique:The pre-doctoral year is a pre-requisite to the doctoral program of the School of Computer Science at UM6P Benguerir.  It consists of a 6-months period of... RESEARCH CLUSTERAI, Data Science, Machine Learning with Pr Echihabi Karima ELIGIBILITY An engineering or master’s degree in computer science from an institution... 16/11/2021 16/01/2022 1, Publication : du 16/11/2021 au 16/01/2022 | Postes proposés: 1, Université Mohammed VI Polytechnique:The pre-doctoral year is a pre-requisite to the doctoral program of the School of Computer Science at UM6P Benguerir.  It consists of a 6-months period of...
Project Manager 1 | BENGUERIR (Maroc), • engineer or master’s degree in management or related field engineer Université Mohammed VI Polytechnique: About UM6P: Mohammed VI Polytechnic University (UM6P,https://www.um6p.ma/en) is an international higher education institution, established to provide research... UM6P - Vacancy for a position of Project ManagerPosition Announcement - Mohammed VI Polytechnic University (UM6P), AgroBioSciences (AgBS)Job Title: Project... 16/11/2021 16/01/2022 1, Publication : du 16/11/2021 au 16/01/2022 | Postes proposés: 1, engineer
Research Chemical engineer | BENGUERIR (Maroc), it is recommended that the candidate demonstrate experience in undertaking independent research, managing research activities. fluency in english as well as a proven ability to write scientific articles are also important. the engineer should be an effective team player to interact constructively with interdisciplinary  both team from cbs and msn departments with different backgrounds. engineer Université Mohammed VI Polytechnique:Mohammed VI Polytechnic University is an institution dedicated to research and innovation in Africa and aims to position itself among world-renowned... Job Description:One Chemical Engineer position in The Design and Development of porous materials for Metal-ion batteries is available in CBS.GPE and MCN... 16/11/2021 16/01/2022 1, Publication : du 16/11/2021 au 16/01/2022 | Postes proposés: 1, engineer
Team Lead Data engineering and Analytics | Benguerir (Maroc), 5+ years of professional software engineering experience Université Mohammed VI Polytechnique:Mohammed VI Polytechnic University is an institution dedicated to research and innovation in Africa and aims to position itself among world-renowned... Responsibilities Manage the day to day activities of the Data engineering team (Scrum Style) Help define strategies and processes to solve our biggest data... 16/11/2021 16/01/2022 1, Publication : du 16/11/2021 au 16/01/2022 | Postes proposés: 1, Université Mohammed VI Polytechnique:Mohammed VI Polytechnic University is an institution dedicated to research and innovation in Africa and aims to position itself among world-renowned...
Operations Planner | Tanger (Maroc), who we are looking for? • master or engineering degree in relevant fields (it, mechanic, automation, civil, industrial, statistics, business administration or alike). • requires a high level of planning and organizational skills. • requires the ability to maintain high level quality of work under pressure. • requires advanced computer skills. • high level of integrity and able to collaborate effectively in a dynamic environment. • proven demonstrated ability to be a team player and is able to work independently within the defined project, maintaining good relationship to customer, staff and other project team members. • must have good analytical skills to be able to provide solutions to issues/exception in a relatively short timeframe. • requires advanced level of verbal and written communications skills in english. nb. if not contacted within 6 weeks, you can consider your applications not short-listed for this position and you are invited to apply for other job opportunities within our group.     APM Terminals is a port infrastructure leader, uniquely positioned to help both shipping line and landside customers grow their business and... • The operations planner is responsible to ensure a rigorous and efficient planning of vessel or activities to enable the achievement of productivity... 15/11/2021 15/01/2022 5, Publication : du 15/11/2021 au 15/01/2022 | Postes proposés: 5,   APM Terminals is a port infrastructure leader, uniquely positioned to help both shipping line and landside customers grow their business and...
PMO / Monitoring BP Officer Efficiency (H/F) | Rabat (Maroc), bachelor or master’s degree (engineering school, business school, university...) in organizational management, project management or equivalent Confidentiel: For one of our projects we're hiring a PMO / Monitoring BP Officer Efficiency ((H/F). Your main mission will be:  Ensure efficiency process implementation and adoption Define Efficiency guidelines & instructions accordingly to... 12/11/2021 12/01/2022 1, Publication : du 12/11/2021 au 12/01/2022 | Postes proposés: 1, Confidentiel: For one of our projects we're hiring a PMO / Monitoring BP Officer Efficiency ((H/F).
Country QEH&S System specialist | Tanger/Kenitra (Maroc), - engineering degree (industrial) or master's degree in quality management, industrial and technical fields. COFICAB is a best-in-class world leader in the manufacturing and sales of automotive cables and wires. The company is a member of the Tunisian multinational... Job purpose : Drives the implementation and the maintenance of Quality, Environement, Health and Safety Managemant System at regional/Country level and... 09/11/2021 09/01/2022 1, Publication : du 09/11/2021 au 09/01/2022 | Postes proposés: 1, COFICAB is a best-in-class world leader in the manufacturing and sales of automotive cables and wires. The company is a member of the Tunisian multinational...
