Laboratory Manager | BENGUERIR (Maroc), required education: ph.d. degree in applied physics or engineering field (ie, electrical engineering or optical engineering) strong knowledge of computing laboratory mechanisms, analog, and digital electronics, circuitry, telecommunications, cad tools, matlab, cryogenics, and optics.  he/she is skilled in the handling of electrical and optical components. Au cœur de la future Ville Verte Mohammed VI à Benguérir, Maroc et située à 30 mn de Marrakech par autoroute ; l’Université Mohammed VI Polytechnique (UM6P),... The laboratory manager will be responsible for the day-to-day operation of the five research platforms and facilities at the UM6P Institute of Applied Physics... 22/12/2021 22/02/2022 1, Publication : du 22/12/2021 au 22/02/2022 | Postes proposés: 1, Au cœur de la future Ville Verte Mohammed VI à Benguérir, Maroc et située à 30 mn de Marrakech par autoroute ; l’Université Mohammed VI Polytechnique (UM6P),...
R&D Consultant ICT (Information & communication technology) | Casablanca (Maroc), - a graduate from a top ranked engineering schools in (ict) field - having an international outlook in terms of studies or professional experiences, particularly in france ; - having at least 3 years relevant work experience, ideally in consulting field ; - excellent writing and communication skills in french with an analytical mind - curiosity, dynamism, adaptability, good interpersonal skills and team spirit are your key success factors ; Leyton: Thanks to our unique methods and 23 years of knowledge and experience, our clients can benefit from complementary sources of financing while remaining focused... Thanks to our unique methods and 23 years of knowledge and experience, our clients can benefit from complementary sources of financing while remaining focused... 19/12/2021 19/02/2022 4, Publication : du 19/12/2021 au 19/02/2022 | Postes proposés: 4, Leyton: Thanks to our unique methods and 23 years of knowledge and experience, our clients can benefit from complementary sources of financing while remaining focused...
engineering R&D Technical Consultant | Casablanca (Maroc), we're recruiting mechanical and general engineers with the following qualities: Fondé à Paris en 1997, Leyton est un cabinet de conseil international dédié au développement... The primary focus of the role will be to provide advice to companies by investigating their latest R&D projects to identify where qualifying work is... 16/12/2021 30/01/2022, Publication : du 16/12/2021 au 30/01/2022, Fondé à Paris en 1997, Leyton est un cabinet de conseil international dédié au développement...
Maintenance Technician - Tanger Med II | Tanger (Maroc), able to interpret engineering drawings, layouts, and specifications   APM Terminals is a port infrastructure leader, uniquely positioned to help both shipping line and landside customers grow their business and... Under guidance of the shift engineer, this position provides technical skills in repairs works on all terminal equipment. Responsibilities... 16/12/2021 16/02/2022 1, Publication : du 16/12/2021 au 16/02/2022 | Postes proposés: 1,   APM Terminals is a port infrastructure leader, uniquely positioned to help both shipping line and landside customers grow their business and...
Operations Supervisor - Tanger Med II | Tanger (Maroc), requires a master in operational research (or any related field) or engineering degree   APM Terminals is a port infrastructure leader, uniquely positioned to help both shipping line and landside customers grow their business and... Key Responsibilities Under guidance of the Execution Manager this position supervises a group of foremen, quay crane checkers, operators & drivers... 15/12/2021 15/02/2022 1, Publication : du 15/12/2021 au 15/02/2022 | Postes proposés: 1,   APM Terminals is a port infrastructure leader, uniquely positioned to help both shipping line and landside customers grow their business and...
Senior Data engineer spécialise Google Cloud GCP/DevOps/Big Data (Casablanca) | casablanca (Maroc), senior data engineer spécialise google cloud gcp/devops/big data (casablanca) engineer Preci: Nous sommes un cabinet de recrutement spécialisé dans les Cadres et Dirigeants pour le secteur IT. Senior Data Engineer spécialise Google Cloud GCP/DevOps/Big Data (Casablanca) Vous contribuez à des projets très innovants et complexes... 13/12/2021 28/12/2021 1, Publication : du 13/12/2021 au 28/12/2021 | Postes proposés: 1, engineer
Global Reporting Analyst | Rabat (Maroc), profil recherché • de formation académique en data analyst ou data engineering ou bi ou data science • vous maitrisez l’anglais (minimum requis b2) et le français à l'écrit et à l'oral • vous avez de très bonnes connaissances en power bi, sql server • vous êtes doté d’esprit d'analyse et de synthèse • vous avez le goût des chiffres • vous avez de bonnes connaissances en langages de programmation power bi (dax, m query) • vous connaissez les techniques d’analyse de données et des éléments qui composent le système bi • vous maîtrisez les systèmes de gestion de bases de données relationnelles (ex : mdx cube) • vous êtes autodidacte et animé par l’auto-formation • vous êtes reconnu pour votre force de proposition, autonomie et esprit d’équipe • rigueur, réactivité, autonomie sont des atouts majeurs pour mener à bien votre mission Webhelp Maroc: Webhelp est leader européen de l’externalisation de la relation client. Fort de ses 55 000 collaborateurs, Webhelp accompagne plus de 500 clients... Mission • Traiter les différentes données des clients globaux webhelp afin de dégager des observations utiles à... 09/12/2021 09/02/2022 3, Publication : du 09/12/2021 au 09/02/2022 | Postes proposés: 3, Webhelp Maroc: Webhelp est leader européen de l’externalisation de la relation client. Fort de ses 55 000 collaborateurs, Webhelp accompagne plus de 500 clients...
Proxy Product Owner (English Speakers) | Casablanca (Maroc), bachelor's degree in software development, computer engineering, it project management or related field; Leyton: Thanks to our unique methods and 23 years of knowledge and experience, our clients can benefit from complementary sources of financing while remaining focused... Define product roadmap for the next 12 months Plays a key part of development events including planning, refinement, review, retrospective, sprints and... 08/12/2021 08/02/2022 2, Publication : du 08/12/2021 au 08/02/2022 | Postes proposés: 2, Leyton: Thanks to our unique methods and 23 years of knowledge and experience, our clients can benefit from complementary sources of financing while remaining focused...
DevOps engineer | Casablanca (Maroc), higher education bac +5 in computer engineering / networks and systems. Leyton: Thanks to our unique methods and 23 years of knowledge and experience, our clients can benefit from complementary sources of financing while remaining focused... As a Devops Engineer, your mail mission will be to ensure the proper functioning of the company's application servers, as well as respect for the... 08/12/2021 08/02/2022 1, Publication : du 08/12/2021 au 08/02/2022 | Postes proposés: 1, Leyton: Thanks to our unique methods and 23 years of knowledge and experience, our clients can benefit from complementary sources of financing while remaining focused...
Industrial engineer - EMEA New Business Quote Estimator – German speaker | tanger (Maroc), engineering , master degree or equivalent, german speaker is mandatory, fluent french & english ability to work in multinational environment. team spirit and ability to manage multiple projects in parallel. transversal management skills and good communication level. good level of computing, ms office: excel, powerpoint word … Aptiv Maroc (ex Delphi): Some see technology. We see a way to make connections. At Aptiv, we don’t just see the world differently; we work to change reality. That means... Role: Define the Manufacturing System for business under quote in EMEA region according to customers specifications & APTIV rules, and support new... 06/12/2021 06/02/2022 2, Publication : du 06/12/2021 au 06/02/2022 | Postes proposés: 2, Aptiv Maroc (ex Delphi): Some see technology. We see a way to make connections. At Aptiv, we don’t just see the world differently; we work to change reality. That means...
Advisory Lead | Rabat (Maroc), master’s degree in engineering or business. Université Mohammed VI Polytechnique:The Africa Business School (ABS) within Mohammed IV Polytechnic University (UM6P, Morocco) is recruiting an Advisory Lead.   The Africa Business School is... Job Duties may include, but are not limited to:  Preparing commercial proposals and tenders for advisory projects. Supporting business development activities.... 03/12/2021 03/02/2022 1, Publication : du 03/12/2021 au 03/02/2022 | Postes proposés: 1, Université Mohammed VI Polytechnique:The Africa Business School (ABS) within Mohammed IV Polytechnic University (UM6P, Morocco) is recruiting an Advisory Lead.   The Africa Business School is...
Advisory Manager | Rabat (Maroc), master’s degree in engineering or business. Université Mohammed VI Polytechnique:The Africa Business School (ABS) within Mohammed IV Polytechnic University (UM6P, Morocco) is recruiting an Advisory Manager.   The Africa Business School is... Job Duties may include, but are not limited to:  Contribute to preparing commercial proposals and tenders for advisory projects. Contribute to business... 03/12/2021 03/02/2022 1, Publication : du 03/12/2021 au 03/02/2022 | Postes proposés: 1, Université Mohammed VI Polytechnique:The Africa Business School (ABS) within Mohammed IV Polytechnic University (UM6P, Morocco) is recruiting an Advisory Manager.   The Africa Business School is...
Software R&D Technical Consultant | Casablanca (Maroc), we're recruiting software engineers with the following qualities: Founded in 1997, Leyton is an international consulting firm and our teams around the world remain devoted to the economic, ecological and social development... The primary focus of the role will be to provide advice to companies by investigating their latest R&D projects to identify where qualifying work is... 03/12/2021 15/01/2022, Publication : du 03/12/2021 au 15/01/2022, Founded in 1997, Leyton is an international consulting firm and our teams around the world remain devoted to the economic, ecological and social development...
IT Field Technician - Certification Comptia A+ | CASABLANCA (Maroc), minimum diploma bac+3 / certificate level qualification in computer science, electronic engineering or equivalent in country it qualification- comptia a+ certification required to comply with the global standard.  Manpower Agences:Présent depuis 1997 au Maroc, Manpower Group est un acteur international incontournable de l’emploi et de l’insertion sociale dans... Provide field operations support to internal and external customers in accordance with the terms of the customer contract and Service Level Agreements... 02/12/2021 02/02/2022 20, Publication : du 02/12/2021 au 02/02/2022 | Postes proposés: 20, Manpower Agences:Présent depuis 1997 au Maroc, Manpower Group est un acteur international incontournable de l’emploi et de l’insertion sociale dans...
IT - Quality Assurance engineer - Tanger Med II | Tanger (Maroc), university degree or bachelor of science (bsc+) in software engineering or related field.    APM Terminals is a port infrastructure leader, uniquely positioned to help both shipping line and landside customers grow their business and... The Quality Assurance Engineer will be responsible for validation and execution of the test procedures for QA testing with live equipment in the terminal,... 01/12/2021 01/02/2022 1, Publication : du 01/12/2021 au 01/02/2022 | Postes proposés: 1,   APM Terminals is a port infrastructure leader, uniquely positioned to help both shipping line and landside customers grow their business and...
ingénieur data analyst | Benguerir (Maroc), master or engineering diploma in data science or equivalent.  Université Mohammed VI Polytechnique:Mohammed VI Polytechnic University is an institution dedicated to research and innovation in Africa and aims to position itself among world-renowned... Responsibilities Create Robust and reliable Data Pipelines, Predictive Models, correlation analysis and Analytics on Signal processing ( 2D/3D image,... 30/11/2021 30/01/2022 1, Publication : du 30/11/2021 au 30/01/2022 | Postes proposés: 1, Université Mohammed VI Polytechnique:Mohammed VI Polytechnic University is an institution dedicated to research and innovation in Africa and aims to position itself among world-renowned...
Data engineer | Sala al jadida (Technopolis) (Maroc), de formation ingénieur en informatique (bac+5) vous avez idéalement 5 à 10 ans d’expérience en tant qu’architecte logiciel, data engineer ou dans une équipe big data. vous disposez des compétences techniques ci-après: engineer Sofrecom Services Maroc: Vous êtes à la recherche d’une nouvelle opportunité de carrière ? C’est le moment opportun de postuler et... Au sein du service Consulting IT du département MIT, auquel vous serez rattaché, vous aurez notamment l'opportunité d'intervenir... 29/11/2021 29/01/2022 1, Publication : du 29/11/2021 au 29/01/2022 | Postes proposés: 1, engineer
Quality Manager Automotive (H/F) | Casablanca (Maroc), an engineer diploma in quality, minimum with experience in automotive wiring industry (minimum 3 years’ experience, is a must) engineer Manpower Agences: Référence mondiale depuis 50 ans en matière de recherche et de gestion des compétences, nous accompagnons depuis 1997... Responsibilities (Tasks): Implement the QMS procedures and ensure the compliance. Obtain the customer certifications and ensure the... 29/11/2021 29/01/2022 1, Publication : du 29/11/2021 au 29/01/2022 | Postes proposés: 1, engineer
Service Desk engineer | Casablanca (Maroc), bachelor degree in computer engineering/computer science/information technology. Air Arabia (PJSC), listed on the Dubai Financial Market, is the Middle East and North Africa’s first and leading low-cost carrier flying to over 150... To provide IT support services to Air Arabia Group users and business teams through various channels such as telephone, web, email or in-person as required.... 29/11/2021 29/01/2022 1, Publication : du 29/11/2021 au 29/01/2022 | Postes proposés: 1, Air Arabia (PJSC), listed on the Dubai Financial Market, is the Middle East and North Africa’s first and leading low-cost carrier flying to over 150...
Project Management Officer | Ben Guerir (Maroc), • engineer or master’s degree in management or related field engineer Université Mohammed VI Polytechnique: About UM6P:Mohammed VI Polytechnic University (UM6P,https://www.um6p.ma/en) is an international higher education institution, established to provide research...  Job/Project description:As part of the human resource development of the Center of Soil and Fertilizer Research in Africa, it is urgently required to recruit a... 26/11/2021 26/01/2022 1, Publication : du 26/11/2021 au 26/01/2022 | Postes proposés: 1, engineer
Senior fullstack developer | Benguerir (Maroc), engineer degree engineer Université Mohammed VI Polytechnique:Mohammed VI Polytechnic University is an institution dedicated to research and innovation in Africa and aims to position itself among world-renowned... We are looking for a Senior fullstack developer to join our engineering team. Our engineering team works with the latest technology - constantly improving our... 25/11/2021 25/01/2022 1, Publication : du 25/11/2021 au 25/01/2022 | Postes proposés: 1, engineer
Software engineer | Benguerir (Maroc), engineer degree engineer Université Mohammed VI Polytechnique:Mohammed VI Polytechnic University is an institution dedicated to research and innovation in Africa and aims to position itself among world-renowned... We are looking for a Software engineer to join our engineering team. Basic Qualifications: Engineer Degree 3+ years experience programming experience in MERN.... 25/11/2021 25/01/2022 1, Publication : du 25/11/2021 au 25/01/2022 | Postes proposés: 1, engineer
AI & Data Science Lead | Casablanca (Maroc), • bac + 5 ou ingénieur avec une spécialité tel que (modélisation et science des données, sciences des données et big data, télédétection et géométrie, data & software engineer, data engineer science des données…etc), vous justifiez d’une expérience de 2 à 5 ans dans un environnement agro-industriel ou autre en tant que data scientist ou data analyst. • maîtrise des techniques et des méthodes liées aux mathématiques appliquées et aux statistiques, • maîtrise des langages de programmation python et r, • maîtrise des langages et des outils de gestion des bases de données sql et non-sql, • maîtrise des outils de gestion des données (sas, spss…). • maîtrise des outils et des algorithmes de traitement d’images, • connaissance des techniques de gestion de projet, • une bonne maitrise langue française à l’écrit et à l’oral. • maitrise de l’anglais. engineer engineer Confidentiel: Entreprise industrielle recherche, un AI & Data Science Lead pour renforcer son centre de compétence pour la région de Casablanca. - Conception et prototypage des Use Cases métiers liés à la donnée en concertation avec les Product-Owners, - Elaboration et... 25/11/2021 25/01/2022, Publication : du 25/11/2021 au 25/01/2022, engineer
Salesforce Consultant | Casablanca (Maroc), bachelor's degree in software development, computer engineering, you have a growing trailhead profile or you have a first experience in object-oriented programming and web design / technologies (html, css, javascript); Leyton: Thanks to our unique methods and 23 years of knowledge and experience, our clients can benefit from complementary sources of financing while remaining focused... Within the international CRM Salesforce Team : You will take part in all the developments of our salesforce application: design, creation, test,... 23/11/2021 23/01/2022 1, Publication : du 23/11/2021 au 23/01/2022 | Postes proposés: 1, Leyton: Thanks to our unique methods and 23 years of knowledge and experience, our clients can benefit from complementary sources of financing while remaining focused...
Civil Manager, Terminal Infrastructure Development - Tanger Med II - Project Contract | Tanger (Maroc), • minimum 7 years relevant experience in a civil engineering and/or construction project related environment . • project or package management experience, where exposure to project controls has a preference. • good working knowledge of civil works contract, particularly involving design & build; knowledge of fidic contracts has a preference • experience of managing large scale infrastructure construction projects or packages with multiple reports and with clear responsibility on achieving safety, time and budget targets. • have a strong understanding of design and construction, built on a solid foundation of technical engineering skills. • team player, capable of motivating peers and reports in order to achieve project success. • good communication skills, where sufficient level of english and french is a must. • driven, self-motivating, result orientated. • high discipline – following through on actions and ensuring necessary documentation. • high quality awareness and ability to work with constant care. • sensitive to cultural diversity and experience in a multicultural environment, in regard to colleagues, employees of designers and contractors, and other stakeholders. APM Terminals operates one of the world’s most comprehensive port and integrated inland service networks and continues investing in new business... We Offer APM Terminals offers tremendous growth, career and leadership opportunities for those with the ambition, drive and dedication to become one of the... 19/11/2021 19/01/2022 1, Publication : du 19/11/2021 au 19/01/2022 | Postes proposés: 1, APM Terminals operates one of the world’s most comprehensive port and integrated inland service networks and continues investing in new business...
engineer position in Numerical Systems and Calculations | Benguerir (Maroc), engineer (or equivalent) in high performance computing and numerical methods, weather and/or climate science, physics or related discipline. engineer Université Mohammed VI Polytechnique:Mohammed VI Polytechnic University is an institution dedicated to research and innovation in Africa and aims to position itself among world-renowned... Mohammed VI Polytechnic University International Water Research Institute (IWRI)  Position Announcement  Job Title: Engineer position in Numerical Systems and... 18/11/2021 18/01/2022 1, Publication : du 18/11/2021 au 18/01/2022 | Postes proposés: 1, engineer
Research engineer position in Climate modeling | Benguerir (Maroc), engineer (or equivalent) in weather and/or climate science, high performance computing science, physics or related discipline. engineer Université Mohammed VI Polytechnique:Mohammed VI Polytechnic University is an institution dedicated to research and innovation in Africa and aims to position itself among world-renowned... Mohammed VI Polytechnic University International Water Research Institute (IWRI)  Position Announcement  Job Title: Research Engineer position in Climate... 18/11/2021 18/01/2022 1, Publication : du 18/11/2021 au 18/01/2022 | Postes proposés: 1, engineer
R&D Consultant ICT (Information & communication technology) | Casablanca (Maroc),   your assets? - a graduate from a top ranked engineering schools in (ict) field - having an international outlook in terms of studies or professional experiences, particularly in france ; - having at least 3 years relevant work experience, ideally in consulting field ; - excellent writing and communication skills in french with an analytical mind - curiosity, dynamism, adaptability, good interpersonal skills and team spirit are your key success factors ; Leyton: Thanks to our unique methods and 23 years of knowledge and experience, our clients can benefit from complementary sources of financing while remaining focused... Thanks to our unique methods and 23 years of knowledge and experience, our clients can benefit from complementary sources of financing while remaining focused... 18/11/2021 18/01/2022 4, Publication : du 18/11/2021 au 18/01/2022 | Postes proposés: 4, Leyton: Thanks to our unique methods and 23 years of knowledge and experience, our clients can benefit from complementary sources of financing while remaining focused...
CBM/PDM engineer: | Tanger (Maroc), - we are looking for you hold an engineering degree (bachelor or master) or equivalent preferably in mechanical, electrical, electronics or automation and you have maintenance experience (5+ years) of which at least 3 years in relevant roles within the heavy asset industry. - you have design experience in establishing state of the art pdm systems with smart sensors, data communication (iot) , data analysis (algorithms), and artificial intelligence ai. - having practical experience in performing weibull analysis (reliability life-data analysis), calculate risk of failures, and producing p-f curve simulating the equipment failure characteristics. - having sound knowledge and experience in how to establish a cbm/pdm system for hidden failure modes of assets. - having experience in asset criticality analysis, and root cause analysis rca. - have a hands-on attitude to solve problems and strong analytical skills with proven expertise in data analytics, statistical tools, advanced excel, and cmms. - having experience in heavy asset monitoring and maintenance as well as with data-driven classification: internal maintenance routines for digitalized terminal equipment, equipment condition monitoring and predictive maintenance practices, will help you to succeed in this role. - you have a high-quality awareness and the ability to work with constant care - your english communication skills are excellent both in speaking as well as in writing. - if you are looking for a positive change in career and if you are ready for this challenge, you are welcome to our apm terminals- am: reliability team.   APM Terminals is a port infrastructure leader, uniquely positioned to help both shipping line and landside customers grow their business and achieve... At APMT we value the diversity of our talent and will always strive to recruit the best person for the job we value diversity in all its forms, including but... 18/11/2021 18/01/2022 1, Publication : du 18/11/2021 au 18/01/2022 | Postes proposés: 1, APM Terminals is a port infrastructure leader, uniquely positioned to help both shipping line and landside customers grow their business and achieve...
